{
  "personal_info": {
    "name": "Andy Craig",
    "email": "andycraig200@gmail.com",
    "phone": "647-808-9481",
    "location": "Toronto, Ontario",
    "github": "https://github.com/AndyCraig200",
    "linkedin": "https://www.linkedin.com/in/andycraig200"
  },
  "education": [
    {
      "institution": "Queen's University",
      "graduation": "Class of 2024",
      "degree": "First Class Honours, Bachelor's of Applied Science in Computer Engineering",
      "gpa": "3.5 / 4.0",
      "location": "Kingston, Ontario",
      "relevant_coursework": [
        "Data Structures and Algorithms (C++)",
        "Distributed Systems",
        "Data Analytics",
        "Database Management Systems",
        "Advanced Computer Architecture",
        "Software Performance Engineering",
        "Software Engineering"
      ]
    }
  ],
  "experience": [
    {
      "company": "ClearEstate",
      "role": "Full Stack Software Engineer",
      "location": "Toronto, Ontario",
      "start_date": "July 2024",
      "end_date": "Present",
      "priority": "high",
      "bullets": [
        "Develop and enhance features for ClearEstate's estate settlement platform, utilizing a Laravel PHP backend and Vue.js frontend to deliver robust and user-friendly solutions.",
        "Maintain and optimize the existing codebase, ensuring high performance, scalability, and reliability of the application through regular code reviews and refactoring.",
        "Collaborate with cross-functional teams, including product managers and designers, to implement new functionalities that streamline estate management processes and improve user experience.",
        "Utilize version control systems (Git) and project management tools (Jira) to coordinate development efforts and ensure timely delivery of project milestones."
      ]
    },
    {
      "company": "Cactus App",
      "role": "Co-Founder and Lead Developer",
      "location": "Kingston, Ontario",
      "start_date": "September 2023",
      "end_date": "April 2025",
      "priority": "high",
      "bullets": [
        "Co-founded cross-platform loyalty rewards application with 3 other co-founders, architecting and developing a complete ecosystem including customer mobile app (React Native/Expo), storefront mobile app, and business web application (Laravel PHP, Vue.js, PostgreSQL).",
        "Led full-stack development of production-ready platform serving businesses of any size, implementing core features including QR code-based point collection, rewards management, analytics dashboards, and automated CI/CD pipelines using GitHub Actions and Laravel Forge.",
        "Successfully exited the company alongside another developer for $20,000 after 19 months of development and market validation, demonstrating strong product-market fit and technical execution."
      ]
    },
    {
      "company": "Ecobee",
      "role": "Machine Learning and Data Engineering Intern",
      "location": "Toronto, Ontario",
      "start_date": "April 2022",
      "end_date": "May 2023",
      "priority": "high",
      "bullets": [
        "Oversaw and maintained production services within the Ecobee ecosystem, including ETL batch and streaming jobs (Apache Beam) and ML Pipelines (Kubeflow).",
        "Engineered an end-to-end evaluation pipeline for a Package Detection computer vision model deployed on doorbell cameras, optimizing model performance and accuracy.",
        "Orchestrated the implementation of a Kubeflow pipeline for smoke/CO alarm detection, streamlining deployment and enhancing system reliability.",
        "Developed a custom metrics API to monitor production services, ensuring adherence to Service Level Objectives (SLOs) and facilitating proactive issue resolution."
      ]
    }
  ],
  "projects": [
    {
      "name": "Pursuit Labs - AI-Powered Talent Management Platform",
      "tech": [
        "AI/ML",
        "Full-Stack Development",
        "Product Management",
        "UI/UX Design"
      ],
      "priority": "high",
      "bullets": [
        "Co-founded and led technical development of AI-powered talent management solutions for mid-to-large-scale companies seeking to optimize task allocation systems.",
        "Oversaw all technical components of the product, including the development of full product feature specifications and UI/UX models.",
        "Achieved 2nd place and secured $5,000 funding at the 2021 Canadian Undergraduate Conference on AI (CUCAI), showcasing early-stage success and product innovation."
      ]
    },
    {
      "name": "Workout Analysis App",
      "tech": [
        "Swift",
        "Tensorflow",
        "YoloV8",
        "Python",
        "Flask"
      ],
      "priority": "high",
      "bullets": [
        "Led the development of WorkoutPal, a workout analysis app that uses YoloV8 pose estimation and computer vision to give users feedback on their workout, including repetition analysis, caloric estimation and form feedback.",
        "Designed and developed an end to end ML pipeline that serves model inference to a SwiftUI iOS application using AWS to host API."
      ]
    }
  ],
  "skills": {
    "languages": [
      "Python",
      "SQL",
      "PHP",
      "Swift",
      "Java",
      "C++",
      "C",
      "Go"
    ],
    "technologies": [
      "Google Cloud Ecosystem",
      "Apache Beam",
      "TensorFlow",
      "PyTorch",
      "Kubernetes",
      "Docker",
      "Airflow",
      "Flask"
    ],
    "concepts": [
      "Machine Learning",
      "Data Engineering",
      "Artificial Intelligence",
      "Cloud Computing",
      "Distributed Systems",
      "Data Science",
      "Neural Networks",
      "Agile Methodology"
    ]
  }
}