{
  "personal_info": {
    "name": "Andy Craig",
    "email": "andycraig200@gmail.com",
    "phone": "647-808-9481",
    "location": "Toronto, Ontario",
    "github": "https://github.com/AndyCraig200",
    "linkedin": "https://www.linkedin.com/in/andycraig200"
  },
  "education": [
    {
      "institution": "Queen's University",
      "graduation": "Class of 2024",
      "degree": "First Class Honours, Bachelor's of Applied Science in Computer Engineering",
      "gpa": "3.5 / 4.0",
      "location": "Kingston, Ontario",
      "relevant_coursework": [
        "Data Structures and Algorithms (C++)",
        "Distributed Systems",
        "Data Analytics",
        "Database Management Systems",
        "Advanced Computer Architecture",
        "Software Performance Engineering",
        "Software Engineering"
      ]
    }
  ],
  "experience": [
    {
      "company": "ClearEstate",
      "role": "Full Stack Software Engineer",
      "location": "Toronto, Ontario",
      "start_date": "July 2024",
      "end_date": "Present",
      "priority": "high",
      "bullets": [
        "Develop and enhance features for ClearEstate's estate settlement platform, utilizing Laravel PHP and Vue.js for user-friendly ML solutions.",
        "Optimize the existing codebase for high performance and scalability through regular code reviews and refactoring.",
        "Collaborate with cross-functional teams to implement functionalities that streamline estate management and improve user experience.",
        "Utilize Git for version control and Jira for project management to coordinate development efforts and ensure timely delivery."
      ]
    },
    {
      "company": "Cactus App",
      "role": "Co-Founder and Lead Developer",
      "location": "Kingston, Ontario",
      "start_date": "September 2023",
      "end_date": "April 2025",
      "priority": "high",
      "bullets": [
        "Co-founded a cross-platform loyalty rewards app, architecting a complete ecosystem with customer and business applications.",
        "Led full-stack development of a production-ready platform, implementing features like QR code point collection and analytics dashboards.",
        "Successfully exited the company for $20,000 after 19 months, demonstrating strong product-market fit and technical execution."
      ]
    },
    {
      "company": "Ecobee",
      "role": "Machine Learning and Data Engineering Intern",
      "location": "Toronto, Ontario",
      "start_date": "April 2022",
      "end_date": "May 2023",
      "priority": "high",
      "bullets": [
        "Maintained production services within the Ecobee ecosystem, including ETL jobs (Apache Beam) and ML pipelines (Kubeflow).",
        "Engineered an end-to-end evaluation pipeline for a computer vision model, optimizing performance and accuracy.",
        "Implemented a Kubeflow pipeline for smoke/CO alarm detection, streamlining deployment and enhancing reliability.",
        "Developed a metrics API to monitor production services, ensuring adherence to SLOs and facilitating proactive resolution."
      ]
    }
  ],
  "projects": [
    {
      "name": "Pursuit Labs - AI-Powered Talent Management Platform",
      "tech": [
        "AI/ML",
        "Full-Stack Development",
        "Product Management",
        "UI/UX Design"
      ],
      "priority": "high",
      "bullets": [
        "Co-founded and led technical development of AI-powered talent management solutions for optimizing task allocation systems.",
        "Oversaw all technical components, including model development, product specifications, and UI/UX design.",
        "Achieved 2nd place and secured $5,000 funding at the 2021 CUCAI, demonstrating product innovation and early-stage success."
      ]
    },
    {
      "name": "Workout Analysis App",
      "tech": [
        "Swift",
        "Tensorflow",
        "YoloV8",
        "Python",
        "Flask"
      ],
      "priority": "high",
      "bullets": [
        "Led the development of WorkoutPal, a workout analysis app utilizing YoloV8 for pose estimation and real-time feedback.",
        "Designed and deployed an end-to-end ML pipeline for model inference to a SwiftUI iOS app, hosted on AWS."
      ]
    }
  ],
  "skills": {
    "languages": [
      "Python",
      "SQL",
      "PHP",
      "Swift",
      "Java",
      "C++",
      "C",
      "Go"
    ],
    "technologies": [
      "Google Cloud Ecosystem",
      "Apache Beam",
      "TensorFlow",
      "PyTorch",
      "Kubernetes",
      "Docker",
      "Airflow",
      "Flask"
    ],
    "concepts": [
      "Machine Learning",
      "Data Engineering",
      "Artificial Intelligence",
      "Cloud Computing",
      "Distributed Systems",
      "Data Science",
      "Neural Networks",
      "Agile Methodology"
    ]
  }
}