{
  "personal_info": {
    "name": "Andy Craig",
    "email": "andycraig200@gmail.com",
    "phone": "647-808-9481",
    "location": "Toronto, Ontario",
    "github": "https://github.com/AndyCraig200",
    "linkedin": "https://www.linkedin.com/in/andycraig200"
  },
  "education": [
    {
      "institution": "Queen's University",
      "graduation": "Class of 2024",
      "degree": "First Class Honours, Bachelor's of Applied Science in Computer Engineering",
      "gpa": "3.5 / 4.0",
      "location": "Kingston, Ontario",
      "relevant_coursework": [
        "Data Structures and Algorithms (C++)",
        "Distributed Systems",
        "Data Analytics",
        "Database Management Systems",
        "Advanced Computer Architecture",
        "Software Performance Engineering",
        "Software Engineering"
      ]
    }
  ],
  "experience": [
    {
      "company": "ClearEstate",
      "role": "Full Stack Software Engineer",
      "location": "Toronto, Ontario",
      "start_date": "July 2024",
      "end_date": "Present",
      "bullets": [
        "Develop and enhance features for ClearEstate's estate settlement platform, utilizing a Laravel PHP backend and modern Vue.js frontend to deliver robust and user-friendly web applications.",
        "Maintain and optimize the existing codebase, ensuring high performance, scalability, and reliability of the application through regular code reviews and implementation of best practices in testing.",
        "Collaborate with cross-functional teams, including product managers and designers, to implement new functionalities that streamline estate management processes and enhance user experience.",
        "Utilize version control systems (Git) and agile project management tools (Jira) to coordinate development efforts and ensure timely delivery of project milestones."
      ]
    },
    {
      "company": "Pursuit Labs",
      "role": "Co-Founder and Lead Software Engineer",
      "location": "Kingston, Ontario",
      "start_date": "August 2020",
      "end_date": "April 2022",
      "bullets": [
        "Co-founder and lead software engineer at Pursuit Labs, specializing in AI-powered talent management solutions for mid-to-large-scale companies seeking to optimize task allocation systems through full-stack web development.",
        "Oversaw all technical components of the product, including the development of robust backend services and full product feature specifications, as well as UI/UX models using modern frameworks.",
        "Achieved 2nd place and secured $5,000 funding at the 2021 Canadian Undergraduate Conference on AI (CUCAI), showcasing early-stage success and product innovation in a collaborative environment."
      ]
    },
    {
      "company": "IHS Markit",
      "role": "Strategic Alliances Intern",
      "location": "Raleigh, VA",
      "start_date": "May 2021",
      "end_date": "September 2021",
      "bullets": [
        "Leveraged programming skills in Python to streamline input data processing and eliminate manual processes, enhancing overall efficiency.",
        "Utilized Power Automate to automate email content extraction and Excel population, reducing new deal profiling time by approximately 10 minutes per deal.",
        "Developed Python scripts to automate the processing of redundant records, resulting in a time-saving of approximately 30 hours over 3,000 entries, optimizing data management."
      ]
    }
  ],
  "projects": [
    {
      "name": "Workout Analysis App",
      "tech": [
        "Swift",
        "Tensorflow",
        "YoloV8",
        "Python",
        "Flask"
      ],
      "bullets": [
        "Led the development of WorkoutPal, a workout analysis app utilizing YoloV8 pose estimation and computer vision to provide users with feedback on their workouts, including repetition analysis, caloric estimation, and form feedback.",
        "Designed and developed a robust end-to-end ML pipeline that serves model inference to a SwiftUI iOS application, leveraging AWS to host the API and ensuring scalability and performance."
      ]
    },
    {
      "name": "Cactus: Loyalty Rewards App",
      "tech": [
        "React Native",
        "Laravel PHP",
        "Expo",
        "CI/CD"
      ],
      "bullets": [
        "Co-founded a customer loyalty rewards app for small to medium-sized businesses lacking resources to develop their own digital loyalty programs.",
        "Designed and developed a full-stack, production-ready application using Laravel PHP for the backend and React Native for the mobile apps, implementing CI/CD practices for efficient deployment."
      ]
    }
  ],
  "skills": {
    "languages": [
      "Python",
      "PHP",
      "JavaScript",
      "SQL",
      "Swift",
      "Java",
      "C++",
      "C"
    ],
    "technologies": [
      "Flask",
      "Kubernetes",
      "Docker",
      "CircleCI",
      "TensorFlow",
      "PyTorch",
      "Google Cloud Ecosystem",
      "Apache Beam"
    ],
    "concepts": [
      "Agile Methodology",
      "Cloud Computing",
      "User Interfaces",
      "Machine Learning",
      "Artificial Intelligence",
      "Data Engineering",
      "Data Science",
      "Distributed Systems"
    ]
  }
}