{
  "personal_info": {
    "name": "Andy Craig",
    "email": "andycraig200@gmail.com",
    "phone": "647-808-9481",
    "location": "Toronto, Ontario",
    "github": "https://github.com/AndyCraig200",
    "linkedin": "https://www.linkedin.com/in/andycraig200"
  },
  "education": [
    {
      "institution": "Queen's University",
      "graduation": "Class of 2024",
      "degree": "First Class Honours, Bachelor's of Applied Science in Computer Engineering",
      "gpa": "3.5 / 4.0",
      "location": "Kingston, Ontario",
      "relevant_coursework": [
        "Data Structures and Algorithms (C++)",
        "Distributed Systems",
        "Data Analytics",
        "Database Management Systems",
        "Advanced Computer Architecture",
        "Software Performance Engineering",
        "Software Engineering"
      ]
    }
  ],
  "experience": [
    {
      "company": "ClearEstate",
      "role": "Full Stack Software Engineer",
      "location": "Toronto, Ontario",
      "start_date": "July 2024",
      "end_date": "Present",
      "priority": "high",
      "bullets": [
        "Develop and enhance features for ClearEstate's estate settlement platform using Laravel PHP and Vue.js for user-friendly solutions.",
        "Optimize the codebase for performance, scalability, and reliability through code reviews and refactoring.",
        "Collaborate with cross-functional teams to implement features that streamline estate management and enhance user experience.",
        "Utilize Git and Jira to coordinate development efforts and ensure timely project delivery."
      ]
    },
    {
      "company": "Cactus App",
      "role": "Co-Founder and Lead Developer",
      "location": "Kingston, Ontario",
      "start_date": "September 2023",
      "end_date": "April 2025",
      "priority": "high",
      "bullets": [
        "Co-founded a cross-platform loyalty rewards app, architecting a complete ecosystem with customer mobile app (React Native), storefront app, and business web app (Laravel, Vue.js, PostgreSQL).",
        "Led full-stack development of a scalable platform, implementing core features like QR code point collection, rewards management, analytics dashboards, and CI/CD pipelines using GitHub Actions.",
        "Exited the company for $20,000 after 19 months, showcasing strong product-market fit and technical execution."
      ]
    },
    {
      "company": "Ecobee",
      "role": "Machine Learning and Data Engineering Intern",
      "location": "Toronto, Ontario",
      "start_date": "April 2022",
      "end_date": "May 2023",
      "priority": "high",
      "bullets": [
        "Maintained production services in the Ecobee ecosystem, including ETL jobs and ML pipelines.",
        "Engineered an evaluation pipeline for a computer vision model, optimizing accuracy.",
        "Implemented a Kubeflow pipeline for smoke/CO alarm detection, enhancing reliability.",
        "Developed a metrics API to monitor services, ensuring SLO adherence and proactive resolution."
      ]
    }
  ],
  "projects": [
    {
      "name": "Workout Analysis App",
      "tech": [
        "Swift",
        "Tensorflow",
        "YoloV8",
        "Python",
        "Flask"
      ],
      "priority": "high",
      "bullets": [
        "Led development of WorkoutPal, an app using YoloV8 for workout feedback.",
        "Designed an end-to-end ML pipeline for SwiftUI app, hosting API on AWS."
      ]
    },
    {
      "name": "Pursuit Labs - Task Management AI",
      "tech": [
        "Prototyping",
        "Business Development",
        "UI/UX Design"
      ],
      "priority": "high",
      "bullets": [
        "Led development of an AI task management platform for mid-to-large companies.",
        "Secured 2nd place and $5,000 funding at the 2021 CUCAI for product innovation."
      ]
    }
  ],
  "skills": {
    "languages": [
      "Python",
      "JavaScript",
      "Go",
      "Java",
      "C++",
      "C",
      "SQL",
      "PHP"
    ],
    "technologies": [
      "Kubernetes",
      "Docker",
      "Flask",
      "Google Cloud Ecosystem",
      "CircleCI",
      "Airflow",
      "Apache Beam",
      "TensorFlow"
    ],
    "concepts": [
      "Agile Methodology",
      "Cloud Computing",
      "User Interfaces",
      "Distributed Systems",
      "Data Engineering",
      "Data Science",
      "Artificial Intelligence",
      "Machine Learning"
    ]
  }
}