{
  "personal_info": {
    "name": "Andy Craig",
    "email": "andycraig200@gmail.com",
    "phone": "647-808-9481",
    "location": "Toronto, Ontario",
    "github": "https://github.com/AndyCraig200",
    "linkedin": "https://www.linkedin.com/in/andycraig200"
  },
  "education": [
    {
      "institution": "Queen's University",
      "graduation": "Class of 2024",
      "degree": "First Class Honours, Bachelor's of Applied Science in Computer Engineering",
      "gpa": "3.5 / 4.0",
      "location": "Kingston, Ontario",
      "relevant_coursework": [
        "Data Structures and Algorithms (C++)",
        "Distributed Systems",
        "Data Analytics",
        "Database Management Systems",
        "Advanced Computer Architecture",
        "Software Performance Engineering",
        "Software Engineering"
      ]
    }
  ],
  "experience": [
    {
      "company": "Ecobee",
      "role": "Machine Learning and Data Engineering Intern",
      "location": "Toronto, Ontario",
      "start_date": "April 2022",
      "end_date": "May 2023",
      "bullets": [
        "Maintained production services within the Ecobee ecosystem, including ETL jobs (Apache Beam) and ML pipelines (Kubeflow).",
        "Engineered an end-to-end evaluation pipeline for a computer vision model, optimizing performance and accuracy for doorbell cameras.",
        "Implemented a Kubeflow pipeline for smoke/CO alarm detection, streamlining deployment and enhancing reliability.",
        "Developed a metrics API to monitor production services, ensuring SLO adherence and enabling proactive issue resolution."
      ]
    },
    {
      "company": "Cactus App",
      "role": "Co-Founder and Lead Developer",
      "location": "Kingston, Ontario",
      "start_date": "September 2023",
      "end_date": "April 2025",
      "bullets": [
        "Co-founded a cross-platform loyalty rewards app, architecting a complete ecosystem including mobile and web applications.",
        "Led full-stack development of a production-ready platform, implementing features like QR code point collection and analytics.",
        "Successfully exited the company for $20,000 after 19 months, demonstrating strong product-market fit and technical execution."
      ]
    },
    {
      "company": "IHS Markit",
      "role": "Strategic Alliances Intern",
      "location": "Raleigh, VA",
      "start_date": "May 2021",
      "end_date": "September 2021",
      "bullets": [
        "Leveraged Python to streamline data processing, eliminating manual tasks for improved efficiency.",
        "Utilized Power Automate to automate email content extraction, reducing deal profiling time by 10 minutes per deal.",
        "Developed Python scripts to automate redundant record processing, saving approximately 30 hours across 3,000 entries."
      ]
    }
  ],
  "projects": [
    {
      "name": "Pursuit Labs - AI-Powered Talent Management Platform",
      "tech": [
        "AI/ML",
        "Full-Stack Development",
        "Product Management",
        "UI/UX Design"
      ],
      "bullets": [
        "Co-founded and led technical development of AI-powered talent management solutions optimizing task allocation for mid-to-large-scale companies.",
        "Oversaw all technical components, including machine learning model development and UI/UX design specifications.",
        "Achieved 2nd place and secured $5,000 funding at the 2021 Canadian Undergraduate Conference on AI (CUCAI), highlighting product innovation."
      ]
    },
    {
      "name": "Workout Analysis App",
      "tech": [
        "Swift",
        "Tensorflow",
        "YoloV8",
        "Python",
        "Flask"
      ],
      "bullets": [
        "Led the development of WorkoutPal, an app utilizing YoloV8 for pose estimation and computer vision to enhance workout feedback.",
        "Designed and deployed an end-to-end ML pipeline serving model inference to a SwiftUI iOS app, hosted on AWS."
      ]
    }
  ],
  "skills": {
    "languages": [
      "Python",
      "SQL",
      "PHP",
      "Swift",
      "Java",
      "C++",
      "C",
      "Go"
    ],
    "technologies": [
      "Google Cloud Ecosystem",
      "Apache Beam",
      "TensorFlow",
      "PyTorch",
      "Kubernetes",
      "Docker",
      "Airflow",
      "Flask"
    ],
    "concepts": [
      "Machine Learning",
      "Data Engineering",
      "Artificial Intelligence",
      "Cloud Computing",
      "Distributed Systems",
      "Data Science",
      "Neural Networks",
      "Agile Methodology"
    ]
  }
}