{
  "personal_info": {
    "name": "Andy Craig",
    "email": "andycraig200@gmail.com",
    "phone": "647-808-9481",
    "location": "Toronto, Ontario",
    "github": "https://github.com/AndyCraig200",
    "linkedin": "https://www.linkedin.com/in/andycraig200"
  },
  "education": [
    {
      "institution": "Queen's University",
      "graduation": "Class of 2024",
      "degree": "First Class Honours, Bachelor's of Applied Science in Computer Engineering",
      "gpa": "3.5 / 4.0",
      "location": "Kingston, Ontario",
      "relevant_coursework": [
        "Data Structures and Algorithms (C++)",
        "Distributed Systems",
        "Data Analytics",
        "Database Management Systems",
        "Advanced Computer Architecture",
        "Software Performance Engineering",
        "Software Engineering"
      ]
    }
  ],
  "experience": [
    {
      "company": "ClearEstate",
      "role": "Full Stack Software Engineer",
      "location": "Toronto, Ontario",
      "start_date": "July 2024",
      "end_date": "Present",
      "bullets": [
        "Develop and enhance features for ClearEstate's estate settlement platform, utilizing a Laravel PHP backend and Vue.js frontend to deliver robust and user-friendly solutions.",
        "Maintain and optimize the existing codebase, ensuring high performance, scalability, and reliability of the application through regular code reviews and refactoring.",
        "Collaborate with cross-functional teams, including product managers and designers, to implement new functionalities that streamline estate management processes and improve user experience.",
        "Utilize version control systems (Git) and project management tools (Jira) to coordinate development efforts and ensure timely delivery of project milestones."
      ]
    },
    {
      "company": "Ecobee",
      "role": "Machine Learning and Data Engineering Intern",
      "location": "Toronto, Ontario",
      "start_date": "April 2022",
      "end_date": "May 2023",
      "bullets": [
        "Oversaw and maintained production services within the Ecobee ecosystem, including ETL batch and streaming jobs (Apache Beam) and ML Pipelines (Kubeflow).",
        "Engineered an end-to-end evaluation pipeline for a Package Detection computer vision model deployed on doorbell cameras, optimizing model performance and accuracy.",
        "Orchestrated the implementation of a Kubeflow pipeline for smoke/CO alarm detection, streamlining deployment and enhancing system reliability.",
        "Developed a custom metrics API to monitor production services, ensuring adherence to Service Level Objectives (SLOs) and facilitating proactive issue resolution."
      ]
    },
    {
      "company": "Pursuit Labs",
      "role": "Co-Founder and Lead Software Engineer",
      "location": "Kingston, Ontario",
      "start_date": "August 2020",
      "end_date": "April 2022",
      "bullets": [
        "Co-founder and software development team lead at Pursuit Labs, specializing in AI-powered talent management solutions for mid-to-large-scale companies seeking to optimize task allocation systems.",
        "Oversaw all technical components of the product, including the development of full product feature specifications and UI/UX models.",
        "Achieved 2nd place and secured $5,000 funding at the 2021 Canadian Undergraduate Conference on AI (CUCAI), showcasing early-stage success and product innovation."
      ]
    },
    {
      "company": "IHS Markit",
      "role": "Strategic Alliances Intern",
      "location": "Raleigh, VA",
      "start_date": "May 2021",
      "end_date": "September 2021",
      "bullets": [
        "Leveraged programming skills to streamline input data processing and eliminate manual processes",
        "Utilized Power Automate to automate email content extraction and Excel population, reducing new deal profiling time by approximately 10 minutes per deal.",
        "Developed Python scripts to automate the processing of redundant records, resulting in a time-saving of approximately 30 hours over 3,000 entries."
      ]
    }
  ],
  "projects": [
    {
      "name": "Workout Analysis App",
      "tech": [
        "Swift",
        "Tensorflow",
        "YoloV8",
        "Python",
        "Flask"
      ],
      "bullets": [
        "Led the development of WorkoutPal, a workout analysis app that uses YoloV8 pose estimation and computer vision to give users feedback on their workout, including repetition analysis, caloric estimation and form feedback.",
        "Designed and developed an end to end ML pipeline that serves model inference to a SwiftUI iOS application using AWS to host API."
      ]
    },
    {
      "name": "Cactus: Loyalty Rewards App",
      "tech": [
        "React Native",
        "Laravel PHP",
        "Expo",
        "CI/CD"
      ],
      "bullets": [
        "Co-founded customer loyalty app for small-medium sized businesses who don't have resources to develop their own digital loyalty program.",
        "Designed and developed full stack production ready application, with custom Laravel API and 2 mobile apps."
      ]
    }
  ],
  "skills": {
    "languages": [
      "Python",
      "PHP",
      "Swift",
      "Java",
      "C++",
      "C",
      "Go",
      "JavaScript",
      "SQL"
    ],
    "technologies": [
      "Google Cloud Ecosystem",
      "Apache Beam",
      "TensorFlow",
      "Flask",
      "PyTorch",
      "Kubernetes",
      "Docker",
      "CircleCI",
      "Airflow"
    ],
    "concepts": [
      "Artificial Intelligence",
      "Machine Learning",
      "Neural Networks",
      "Data Engineering",
      "Data Science",
      "Agile Methodology",
      "Cloud Computing",
      "Operating System",
      "Virtual Memory",
      "Encryption",
      "Networks",
      "Distributed Systems",
      "User Interfaces"
    ]
  }
}