{
  "personal_info": {
    "name": "Andy Craig",
    "email": "andycraig200@gmail.com",
    "phone": "647-808-9481",
    "location": "Toronto, Ontario",
    "github": "https://github.com/AndyCraig200",
    "linkedin": "https://www.linkedin.com/in/andycraig200"
  },
  "education": [
    {
      "institution": "Queen's University",
      "graduation": "Class of 2024",
      "degree": "First Class Honours, Bachelor's of Applied Science in Computer Engineering",
      "gpa": "3.5 / 4.0",
      "location": "Kingston, Ontario",
      "relevant_coursework": [
        "Data Structures and Algorithms (C++)",
        "Distributed Systems",
        "Data Analytics",
        "Database Management Systems",
        "Advanced Computer Architecture",
        "Software Performance Engineering",
        "Software Engineering"
      ]
    }
  ],
  "experience": [
    {
      "company": "ClearEstate",
      "role": "Full Stack Software Engineer",
      "location": "Toronto, Ontario",
      "start_date": "July 2024",
      "end_date": "Present",
      "bullets": [
        "Develop and enhance features for ClearEstate's estate settlement platform, utilizing a Laravel PHP backend and Vue.js frontend to deliver robust and user-friendly solutions.",
        "Maintain and optimize the existing codebase, ensuring high performance, scalability, and reliability of the application through regular code reviews and refactoring.",
        "Collaborate with cross-functional teams, including product managers and designers, to implement new functionalities that streamline estate management processes and improve user experience.",
        "Utilize version control systems (Git) and project management tools (Jira) to coordinate development efforts and ensure timely delivery of project milestones."
      ]
    },
    {
      "company": "Cactus App",
      "role": "Co-Founder and Lead Developer",
      "location": "Kingston, Ontario",
      "start_date": "September 2023",
      "end_date": "April 2025",
      "bullets": [
        "Co-founded cross-platform loyalty rewards application with 3 other co-founders, architecting and developing a complete ecosystem including customer mobile app (React Native/Expo), storefront mobile app, and business web application (Laravel PHP, Vue.js, PostgreSQL).",
        "Led full-stack development of production-ready platform serving businesses of any size, implementing core features including QR code-based point collection, rewards management, analytics dashboards, and automated CI/CD pipelines using GitHub Actions and Laravel Forge.",
        "Successfully exited the company alongside another developer for $20,000 after 19 months of development and market validation, demonstrating strong product-market fit and technical execution."
      ]
    },
    {
      "company": "Pursuit Labs",
      "role": "Co-Founder and Lead Software Engineer",
      "location": "Kingston, Ontario",
      "start_date": "August 2020",
      "end_date": "April 2022",
      "bullets": [
        "Co-founder and software development team lead at Pursuit Labs, specializing in AI-powered talent management solutions for mid-to-large-scale companies seeking to optimize task allocation systems.",
        "Oversaw all technical components of the product, including the development of full product feature specifications and UI/UX models.",
        "Achieved 2nd place and secured $5,000 funding at the 2021 Canadian Undergraduate Conference on AI (CUCAI), showcasing early-stage success and product innovation."
      ]
    }
  ],
  "projects": [
    {
      "name": "Workout Analysis App",
      "tech": [
        "Swift",
        "Tensorflow",
        "YoloV8",
        "Python",
        "Flask"
      ],
      "bullets": [
        "Led the development of WorkoutPal, a workout analysis app that uses YoloV8 pose estimation and computer vision to give users feedback on their workout, including repetition analysis, caloric estimation and form feedback.",
        "Designed and developed an end to end ML pipeline that serves model inference to a SwiftUI iOS application using AWS to host API."
      ]
    }
  ],
  "skills": {
    "languages": [
      "Python",
      "PHP",
      "JavaScript",
      "SQL",
      "Swift",
      "Java",
      "C++",
      "C"
    ],
    "technologies": [
      "Flask",
      "Kubernetes",
      "Docker",
      "CircleCI",
      "TensorFlow",
      "PyTorch",
      "Google Cloud Ecosystem",
      "Apache Beam"
    ],
    "concepts": [
      "Agile Methodology",
      "Cloud Computing",
      "User Interfaces",
      "Machine Learning",
      "Artificial Intelligence",
      "Data Engineering",
      "Data Science",
      "Distributed Systems"
    ]
  }
}