{
  "personal_info": {
    "name": "Andy Craig",
    "email": "andycraig200@gmail.com",
    "phone": "647-808-9481",
    "location": "Toronto, Ontario",
    "github": "https://github.com/AndyCraig200",
    "linkedin": "https://www.linkedin.com/in/andycraig200"
  },
  "education": [
    {
      "institution": "Queen's University",
      "graduation": "Class of 2024",
      "degree": "First Class Honours, Bachelor's of Applied Science in Computer Engineering",
      "gpa": "3.5 / 4.0",
      "location": "Kingston, Ontario",
      "relevant_coursework": [
        "Data Structures and Algorithms (C++)",
        "Distributed Systems",
        "Data Analytics",
        "Database Management Systems",
        "Advanced Computer Architecture",
        "Software Performance Engineering",
        "Software Engineering"
      ]
    }
  ],
  "experience": [
    {
      "company": "ClearEstate",
      "role": "Full Stack Software Engineer",
      "location": "Toronto, Ontario",
      "start_date": "July 2024",
      "end_date": "Present",
      "bullets": [
        "Develop and enhance features for ClearEstate's platform using Laravel PHP and Vue.js.",
        "Optimize codebase for performance, scalability, and reliability through reviews.",
        "Collaborate with product managers and designers to streamline estate management.",
        "Utilize Git and Jira for version control and timely project delivery."
      ]
    },
    {
      "company": "Cactus App",
      "role": "Co-Founder and Lead Developer",
      "location": "Kingston, Ontario",
      "start_date": "September 2023",
      "end_date": "April 2025",
      "bullets": [
        "Co-founded a loyalty rewards app, architecting a full ecosystem with React Native, Laravel PHP, Vue.js, and PostgreSQL.",
        "Led full-stack development of a production-ready platform with QR code point collection, rewards management, and CI/CD pipelines using GitHub Actions.",
        "Exited the company for $20,000 after 19 months, showcasing strong product-market fit and technical execution."
      ]
    },
    {
      "company": "Pursuit Labs",
      "role": "Co-Founder and Lead Software Engineer",
      "location": "Kingston, Ontario",
      "start_date": "August 2020",
      "end_date": "April 2022",
      "bullets": [
        "Co-founder and lead software engineer at Pursuit Labs, focusing on AI-driven solutions.",
        "Led development of full-stack web applications, including UI/UX and backend services.",
        "Secured 2nd place and $5,000 funding at 2021 CUCAI for product innovation."
      ]
    }
  ],
  "projects": [
    {
      "name": "Workout Analysis App",
      "tech": [
        "Swift",
        "Tensorflow",
        "YoloV8",
        "Python",
        "Flask"
      ],
      "bullets": [
        "Led development of WorkoutPal, a workout analysis app using YoloV8 for feedback.",
        "Designed an end-to-end ML pipeline serving model inference to a SwiftUI app on AWS."
      ]
    }
  ],
  "skills": {
    "languages": [
      "Python",
      "PHP",
      "JavaScript",
      "SQL",
      "Swift",
      "Java",
      "C++",
      "C"
    ],
    "technologies": [
      "Flask",
      "Kubernetes",
      "Docker",
      "CircleCI",
      "TensorFlow",
      "PyTorch",
      "Google Cloud Ecosystem",
      "Apache Beam"
    ],
    "concepts": [
      "Agile Methodology",
      "Cloud Computing",
      "User Interfaces",
      "Machine Learning",
      "Artificial Intelligence",
      "Data Engineering",
      "Data Science",
      "Distributed Systems"
    ]
  }
}